"rating","reviewContext/null","text","name"
,,"This review is only for phone routing of my initial call. I never spoke to a local person, was put to an answering service, then phone tree. Just need a local electrician.","M"
,,"Mr. Silvas comes to your residence to fix any electrical problems. He installed ceiling fans for me.  Very nice and professional.","Sheila Wilkerson"
,"Yes","I used Raul for a second time and he had his guys come right out and help me the same day, his quote was reasonable and he provides good professional service.","T L (topshelf)"
,"No","No call no show after making a appointment a week prior.  I called a hour after he was suppose to arrive and he said he had forgot and also had lost my number.  Which one is it?  I told him to forget it.  Not reliable!","T"
,,"I had need of an electrician to resolve an issue with a circuit breaker which would not reset and phoned Mr. Silva for assistance.  He arrived (as planned) within several hours after my initial call in what I consider a timely manner.  I found him to be patient, friendly and he listened closely as I explained what my issue was and what my expected outcome was.  He stated that he had another scheduled stop but he could spend approximately an hour working on resolving my issue.  He stated his fee for service up front which I agreed upon and he was able to successfully complete the work in under an hour.  I found Mr. Silva to be what I would consider a knowledgeable and honest man attempting to fix electrical issues a homeowner has at a reasonable price.  Would I use his services again?  I would not hesitate calling Mr. Silva again for any electrical work that I needed and I will gladly recommend him to others.  I've put his name in my contact list for future reference.","Rich Hare"
,,"Raul is very courteous and will work with you to find out your needs. His work is topshelf. You usually have to leave a voicemail and he will call you. Highly recommend.","James Evans"
,"Yes","I needed to have all my outlets and switches  installed in my small home before I started insulating the walls.  Mr. Silva quoted me a good price and did excellent work in the time promised.  He even provided some suggestions I hadn't thought of at no extra cost.  And, after discussing the insulation work I was going to start on, he noticed the venting that I hadn't considered and told me how I can insulate the roof and lofts and keep the vents still open.  I not only have an electrician I trust for future work but I also consider him a trusted friend now.","Ed Ortiz"
,,"After hurricane Michael came through panama city fl it was impossible to get ahold of a electrician, we found raul's number on Google and he got to us quickly and was a honest man unlike some of these people who try to jack the price up bc insurance is paying I highly recommend Raul, he did a great job and was easy to deal with.","Sarah McCutchen"
,,"Very helpful in my time of need right before Christmas. Quick, efficient, and informative on my options!","cara white"
,"Yes","Great company, they are honest and do great work!","Tim Harrison"
,,,"Stacy Adams"
,,"Techs are knowledgeable! Great help finding obsolete parts","Rick Mcnamara"
,,,"Joshua Jackson"
,,,"April Jordan"
,,"Responds quickly with friendly service. Reasonable rates.","Utility Superintendent"
,,"Called several times never got ahold of anyone kept going to a full voice-mail.","Richard Rivera"
,,"Kyle and his helper are very Professional, respectful, courteous, punctual and hard working. Changed an attic fan out in 120 degree temperatures, also got to me within a 24 hour period. Would highly recommend!!","Randal Douglas"
,"Yes","Kyle is extremely friendly. He shows up when he says he will, which means a lot! He did a great job for us","Lori Gilbert"
,"Yes","Professional and courteous. They did a great job figuring out my old panel and adding a new 240v service that met code and didn't break the bank. Also quickly fixed a lighting problem that hadn't worked right for years. I highly recommend them for any electrical work.","Chip Eitel"
,"Yes",,"Ricky"
,"Yes","Kyle did a great job wiring our hot tub.  Very knowledgeable and is conscious of sub division rules.","Guy Grissom"
,"Yes","Kyle does excellent work at a reasonable price. He also stands behind his work. I highly recommend him.","Billy Jay McNeil Jr"
,"Yes","Great person!  Very neat with his work.  Highly highly recommended for electrical work needed!","Preston Harrell"
,,"Caper Waller is the best ever! I highly recommend Waller Electric, you will not be disappointed!","Edith Eiland"
,,"Booked an appointment on Friday for 8 am the following Wednesday, 8 Wednesday comes around and no electrician, 8:30 still no one, by 8:45 I call the office. The lady who answers says she'll find out whats going on and call me back, 10 minutes later she calls back and tells me she was sorry they had lost my appointment and something about someone being on vacation and offered to send someone out Friday. No thanks, since my business wasn't important enough for you to keep up with the first appointment I'll take it somewhere else. I hope they're enjoying their vacation because I wasted half of one of my vacation days waiting for them.","Wesley Downs"
,,,"THA 1"
,,"Great Service!!! Residential and commercially these guys are the Best of the Best!!!","Ed Moore"
,,"A place where employees insist calling you ""BOY"" instead of sir I honestly will not do any business with them anymore.","Esias Shark III"
,,,"Sam Smitherman III"
,,,"Ken Wall"
,,"Doesn't do electrical work anymore.","Joe Gillenwaters"
,,,"Dennis White"
,,"They were promp and were professional.  And FRIENDLY. We will use them again if we need an electrician","Sharon Blackman"
,,"Came when he said he would and did a good job!","Nadeena Power Kersey"
,,"Prompt professional service.","Fan Morrison"
,,,"Kristi 713"
,"Yes","Excellent service. Really quick response.","Jaymi Carter-Ritchie"
,,"Tommy did a good job on my electrical problems","Alex Onder"
,,"AVOID!!!    Asked for a estimate got left with no power to my central unit and all but two screws left in my fuse panel. AVOID AT ALL COST!!!","Just mail"
,,"Didn't receive a receipt from them like I requested so i dont know how long it will work so not pleased also the recommended a plumber bryan they unplugged my freezer so im not happy with that I'm upset about that paid for the plumbing had to fix myself","Melissa Oldham"
,"Yes","I’m not one for leaving reviews, but Tommy with Turner Electric is worth it! He was able to figure out why half the power in my kitchen was out, repaired several outlets…he is honest, fair, down to earth and was even patient enough to explain as he went! (I tend to hover lol) I would absolutely recommend, and will definitely save this number for any future electrical issues that come up!","stephanie decheine"
,"Yes","We have had an amazing experience every time Tommy has worked on something in our home. He is friendly and gets the job done every time! Highly recommend!","Carole"
,,"I hired this company through Angi app because the electric outlets in my living room hallway and front porch stopped working.He called himself doing trouble shooting and I paid him.$350 for the work he did that day. I got no receipt no itemized list of repairs. The problem reoccured and was made worse because lighting in back of home wasn't working. He came back out the lighting in back of home now works but the original problem still exists. I've paid him $600 in less than one week! I now have to start over and find a REPUTABLE electrician.Amgi needs to vet the workers better BEFORE ADVERTISING THEM ON YOUR APP!","Angela Destiny"
,,"This man is like an Airhead when it comes to Electric work. There is no way he should have a license. It took him 2+ months to do a hour or 2 worth of work. Some of the extra time he took at my home is repaing the walls he damaged in my home and waiting for the proper paint color match to arrive. Don't let this man near your home or business. His name is Gary and his Assistant is Terrance who has even less of a clue!","Colette Rutledge"
,,"This electrician is a disaster. Gary arrived at my home on 10/31/23 to provide a quote to update wiring on a 3-way switch in my kitchen. I agreed on his price and he showed up late the following week with a helper, who was a professional young man, unlike Gary.

After pulling switch plates and switches out of boxes. Gary decided he started too late and would need to return another day. I explained my travel requirements and the upcoming holiday and he agreed to return the following Thursday. He left my home with exposed LIVE wires and filthy finger prints all over my walls, despite doing no work!

The following Thursday Gary was a no show!!!! When I called he apologized and said he forgot or got too busy. I told him to return to my property to put my switch boxes back the way they were and collect his materials. I called him again on 11/17 about his intentions to put my boxes back together and he made more excuses about his assistant no longer working for him( no surprise) and he could come on Thursday…Thanksgiving!!!! I told him no and that I have family coming over and this is a hazard that has to be correct asap. He told me he would get back to me.

When I told him I would report this to the county, he said whatever.

This man is a disaster and unprofessional. Run!","M Phillips"
,"Yes","Great Job! I called Mr. Gary H. and problem solved!!!

Now - l will say. Talk of fair pricing, problem solved to the root, honesty and transparency, not to forget timeliness for a weekend job.

#PeaceOfMind #Trustworthy #Great Service

Money can’t buy any of those qualities.","Virtuous Women Praying Alter"
,,"When I called and texted him, I hadn't heard from him","Kathy Edmond"
,,"G&H did an outstanding job on this house and with the appliances as well. Gary is a great Stand -up guy who truly knows his trade. I wish I could give more than 5 stars. Great job G&H!!!!","Jay Jackson"
,"Yes","Gary replaced our old bulb electrical panel with a new upgraded one. He was very nice and professional!","BJ"
,,,"Courtney Thomas"
,"Yes",,"Zach White"
,"Yes",,"Michelle Scott"
,"Yes","If it was possible to give 0 stars I would. These people never answer the phone. When they do answer you get the owner of the company and he proceeds to tell you that his technician will call you back but he never does. My warranty company dispatched this company on April 8th to fix my washing machine. It is now  may 4th. I called around the 18-20 to get an update from the company and they told me they didn’t have my work order number. Never once did they think to call me or my warranty company to get the work order number. This is terrible customer service. The straw that broke my back was the owner last week scheduled and appointment for today may 4th to come fix my washer. I called the company twice and didn’t get an answer. I had to call my warranty company to get them to answer and come to find out they won’t be at my house until tomorrow. Never once did they call to tell me this. Never once did they tell the warranty company. I don’t know if it’s the technicians or the management but stay away from this company.","Garrett Reneau"
,"Yes",,"Bonnie Ferguson"
,"Yes",,"Meme 2"
,"Yes","They took $85 service fee and never return","Alvin Will"
,"Yes","Gary answered our Saturday afternoon emergency call and traced the issue back to the meter. We got the power company out right after he finished and they found the problem. He was professional, thorough, shared some of his expertise, and just a very nice person. 10/10 will use again!","Jaimie Gonzalez"
,"Yes","I needed a disconnect for my water heater Gary was the first one to call me back. he came out the same day and gave me a quote the next day he had it installed he's very professional and friendly.I will definitely use him for future projects.","Brian Johnson"
,"Yes","I had some issues with my lighting. Some kind of way I messed up something and had no power in my bathrooms. Mr Gary was the only Eletrician to call me back, after calling several companies, and fixed my issue the same day. I would highly recommend this company to anyone in need of their services.","Angela Hill"
,,,"J Jaxn"
,"Yes",,"Eric C."
,,"Gary of G&H was very professional and corrected the wiring issues I had very quickly. I am already working with G&H on another project.","Mark Lupo"
,"Yes",,"Eric Vaughan"
,,"Gary was very thorough and professional. He handled  the rewiring of my pool pump skillfully. It just took one diagnose and he solved the issue. I would recommend him to family and friends.  I will use Gary again.","Mattie Lee"
,,"Professional, prompt service. Gary knows his craft and I highly recommend him for your electrical and plumbing needs","Rhonda Doleman"
,,,"Steve Abney"
,,"Long wait","Rachel Stallings"
,,"They would not help me when I really needed it to.","NATE GOODMAN"
,,,"Brandon Holcomb"
,,"Very professional did job and left everything in orderly fashion. Would use again","Brenda Watwood"
,,,"*ÅMÅRÅ* *KIRCUS* (*•*ÂMY*•*)"
,,,"Ramona Watson"
,"Yes","I greatly appreciate the work the guys at Williams did for me , they were informative about what it was I was needing done they always showed up on time , on there first visit they assess the situation knew what needed to be done and immediately began necessary repairs I would 100% recommend these guys to anyone needing electrical work done , they replaced my meter base and rewired my breaker box, I thank you guys and appreciate the efforts put in to assure the job was done CORRECTLY","RARE REEFA"
,"Yes","To start they had already no-showed. They then showed up over an hour late. They were supposed to install outlets in my detached garage, and power to the shop as well. In the process of doing this, they damaged the wiring in the ground. They dug directly where other wires lay, and cut them. Then they repaired them with electrical tape alone, in an area where it floods. This is not the proper fix for this! We went not even two months and realized that they killed the line that goes to our well, leaving us without water. They will now not answer any phone calls, texts, or voicemails even before we knew that this is what they had done. Everything about this has been shady and beyond poor professionalism. Save yourself the money and go with a better company who will do things the right way.","Jennifer Burnett"
,,"David is the best electrician I have ever seen! He does amazing quality work all in the name of Jesus!!","Preston Devillier"
,,"Contact them for a free in-home estimate, and schedule within a couple of days.
They've installed recessed lighting in our living and bedroom today and a ceiling fan in the bedroom. There were some track lights and other fixtures that had to be taken out and patched. The electricians showed up exactly when scheduled. They did a walk-through to confirm placement and got to work. Extremely happy with how everything turned out. They covered everything in plastic before starting and did an excellent job.
I will use them again to do the rest of the rooms in a couple of months.","Camila Harrison"
,,"Happy at last! This contractor always delivers! Our real-estate company manages several condominiums in the area and we always get electrical-related complaints from tenants. Good thing their electricians work fast.","Harold Thurman"
,,,"VQ3.5_ _"
,,"Scott and his staff are amazing at troubleshooting electrical issues. They were quick to respond and have great customer service.","Mandy Barbaree"
,,,"Melinda Velasquez"
,,"Super professional, honest and trust worthy!","Jessica F"
,,"We had to rebuild the service to our home. Scott was efficient and got the project completed on time. He was knowledgeable and fair priced.","Kim Funderburk"
,,,"Jessica McCullars"
,,,"Johnson Trawick"
,,"Scott and his team are courteous and knowledgeable. I can always depend on them to do a great job!","Flowers Flowers"
,,"Had problems with 4 ceiling fans.  Either the fan didn't work or the light didn't work.   Gary and Jonathan came to check it out.   He said that there would be no problem repairing them. He quoted a fair price.   He promised to be here and were there.   They were polite, courteous, knowledgeable and professional.    They did a great job.   Any future electrical problems I know where to call.  I will recommend them to my family, friends and neighbors.","Michael Termine"
,,"Called to see about getting an outlet installed as well as fix a switch that wasn't working. Scott and another electrician showed up, diagnosed  and repaired the switch problem, installed a new outlet, cleaned up the mess, and were done in about 30 minutes. The price was very reasonable and I will definitely be calling again for any other electrical needs. They were very courteous and didn't mind all of my curious animals.","Angela Cofer"
,,"Bluff Creek did the electrical work for our whole home renovation in Waterloo.  Troy communicated well throughout and was responsive to me all the way through.  The electrical aspects of the project went very smoothly, even when it was necessary to pivot to alternatives (as is common in renovations).  I will continue to call Bluff Creek whenever I need an electrician.","Richard E"
,"Yes","Bluff Creek did the electrical installation on our new pool. He  explained in detail what he would do, and took the time to answer all of my questions. Workmanship was excellent at a reasonable price. Will call Troy for my next electrical project.","Beverly Peebles"
,"Yes","Previous 5 stars must have come from family members because this person is extremely unreliable and I am not the only person who thinks so. And he has been a no show multiple times.  Quality of work ok but often will take repeated  visits to get it right.  Will never use again","Randy Wellman"
,,"Great guys got out fast at short notice will use them for all my jobs","William Gibbs"
,"Yes","I've hired many different contractors and have always been disappointed. They usually take my money and do not complete the job or the work is shoddy and I have to call in someone else to do the job correctly and pay more. This was the very first time I called a contractor that responded immediately and did everything top notch. I lost power due to a storm. The utility company came out to the house and cut the power to prevent a fire. I called Troy and he was at the house the next day to do the work. Not only did he repair the meter, he called and coordinated the inspection and had the utility company come back out and restore the power all on the same day of the repair. He was in constant communication with me letting me know what was happening each step; and went above and beyond by going back and forth to my house to meet the Inspector and double check to make sure the power was restored. For all of his hard work, his price was ""extremely"" reasonable. Without a doubt, I would recommend Troy to anyone needing any electrical work. Thank you so much for getting my power back on. Top notch job!!","Diana Constable"
,,"I called and they responded so quickly. We decided on a day and unfortunately we ran into an emergency and needed it sooner. Without hesitation they came out and ran our plug. They were professional and very informative. From now on I will call them for all my electrical needs.","Bambi Sebelski"
,"Yes","Troy was excellent to work with. He got a hired hand, Jarrett, out to the house quickly and solved our issue. Jarrett was polite and professional. We needed our stove set up for a 220v. Simple fix. But they were courteous, proficient, and flat out awesome. 10/10 would recommend to use again.","Kyle Gvillo"
,"Yes","We called several places to get a repairman for an outlet not working. Bluff Creek responded and sent a crew within a few hours. The guys were knowledgeable and able to resolve the problem in a few minutes.  Thank you Bluff Creek!","Judy Dawson"
,,"The number you are calling is a personal persons phone that is unrelated to this company. Stop calling this number","Stephanie Cole"
,,,"djuna james"
,,"Awesome","no body"
,,"AART Electrical Services added additional socks in 2 bedrooms. The technician was very professional and did an amazing job!! We will definitely use them again!!","Marion Fletcher"
,,"AART Electrical Services did some subpanel and wiring work for me recently.  Due to some personal challenges I had in life I needed to get this done very quickly. This company came highly recommended by another contractor working on my home, and was able to fit me into their shedule on short notice. Did a great job, owner is reliable and easy to work with, provides high quality services with follow through to the end.  The owner ensures the customer is happy with the work and that the work is done correctly.  His workers were very kind and polite.  They all worked hard and everything is working well.  I recommend this company and would hire again.","LL K"
,,"Have used them for years we have been extremely happy with quality, service, prompt response and affordability.","Trisha Ergle"
,,,"sofia bates"
,,"This guy made an appointment with me 4 days prior, then day of, said he didn't have my address, yet he had 4 days to ask for it, then day of, waits till almost time to be here to ask for my address. I give it, and then he tells me he thought I was in Madison, 45 minutes or more later. I had company coming, so I asked to reschedule, then the dude doesn't even give me a time. I had to ask 3 times over a 2 day period, only to get ""Look, I'm busy, 5:00 p.m.""  On a flipping Saturday.  So I guess it must be nice to have so much work, you can diss potential customers. Steer clear of this guy.","Jim Ferrell"
,,"Ram's Delta Electric, is a very capable and efficient company. Ram & Rachel, helped us out w/an issue we were having w/an outdoor, walkway fixture (mounted on a brick pillar). The problem was resolved in a timely manner. Ram & Rachel, are extremely personable and so easy to work with! We felt we received excellent service at a fair price, and we would not hesitate to call on them again - we highly recommend, Ram's Delta Electric - give them a try, you'll be glad that you did!

Larry & Joni Hyatt, Huntsville, AL","Larry Hyatt"
,,"Great work","Paula “Yesenia” Palencia"
,"Yes","Ram and his team are absolutely wonderful to work with! He shows up on time, communicates great, and does amazing work at a fair price. Would definitely recommend!!","Symphony Keeton"
,,"These guys fixed what should’ve been a simple issue (previous owners were not electricians by far) and did it quickly and didn’t break the bank. They were so nice to me and my father. Highly recommend them!!","jenness34"
,,"Great company to work with. Top-notch electricians.","Steve Garner"
,"Yes","John went above and beyond for me, very professional and very prompt, thank you so much !","diana duncan"
,,,"Don McCord"
,"Yes",,"Drew Mitchell"
,,,"John Pumphrey"
,,,"Mason Whitehead"
,,"He was honest and reasonably priced","Linda Loomis"
,,,"Lisa Reed"
,,"awesome","no body"
,,,"Ko Ko"
,,"Friday morning we had a tree fall and rip the conduit pole down from our home leaving us with no power. So after a long stressful day of calling every electrician in the the area and almost giving hope of getting any repairs done by bedtime, or even over the weekend,
Kevin of Echols Electical reached out and let me know he was on his way, he got here around 5:30 pm and refused to leave until the job was done, and we were able to call the power company to come inspect and reconnect, so we would not be left without power through out the night! This man and and his crew were absolutely amazing from start to finish! And they were lifesavers! They worked for several hours after business hours in the non stop pouring rain to ensure that our family did not have to continue to go without power. And they did an awesome job. As we go to bed, with the power back up and running, I just cannot express how grateful I and my family are for these men’s hard work and genuine kindness this evening! I would highly recommend Echols Electrical to anyone needing electrical work done!","Alexis Shelton"
,,"Kevin is the best!   He responds quickly to calls & texts and even quicker to get the job done.  My elderly mother needed a security light replaced and he took great care of her.  I highly recommend Echols Electrical for all of your electrical needs.  His  crew is not only quick, but efficient and customer service is definitely the best.","Stephanie Hodges"
,,"We had damage due to a lightning strike. Called on a holiday and Kevin called me right back and he was able to come out very fast. Made all the necessary repairs so we were able to turn our power back on. Very fair prices, personable and respectful. He really saved the day for us.","T Y"
,,"Kevin and his crew were amazing. Super professional and knowledgeable. We needed a couple extra outlets and lighting added in and they got it done quickly and didn't leave a mess. I highly recommend them for any of your electrical needs. We'll be using them again for sure!","Carly Wood"
,,"Called and left a message, but no return call.  Not dependable.","Greg Black"
,"Yes","Awesome job done right and affordable 👏","annette pesante"
,"Yes","We had an issue with electrical panel and Echols provided same day service.
Very friendly, professional and economical . Highly recommend.","Kelly Milleruwa"
,,"Good guy does good work ..","Anthony Ledbetter"
,,"Left a message for someone to call me. Never heard from anyone. Called another company and they came the very next day and fixed my problem.","Charlotte White"
,"Yes",,"Wayne Martin"
