"rating","reviewContext/null","text","name"
,,"Not recommended.","Tracy McGuire"
,,"Run don’t walk away from this electrician. Actually to call this person an electrician is an insult to all electricians everywhere. They were asked to add an outlet in the hallway of this home and they used a hammer to knock a hole in the paneling and just shoved an outlet in the hole without a junction box and they connected the outlet to a circuit that was ungrounded so he cut the ground wire out and didn’t gfi protect it. This guy made many, many other code violations in this house. And I would be surprised if this person were actually licensed with the state. If they are licensed they need to be reported to the state board of licenses for official review. Anyone who willfully violates Electrical codes with this much reckless abandon and actually charges people for it needs to be run out of business. I say all of this because I am a state licensed master electrician and I was called in to clean up this guys mess.","shane roney"
,,,"James Evans"
,,"Ok, so they have a $150 fee to come out. It's honestly worth it. We had 4 outlets stop working entirely in our tiny home and didn't know what to do because nothing seemed wrong. Two guys showed up. They were as prepared as they could ever be, found the wire problem (that was in the ceiling, mind you), and got us back to full operation within an hour. They were good sports too, even explained what they were doing in a way I could understand. 10/10 would and will call again when something else happens. Thank you.","Jelly Starfish"
,,"Dr. Watts electrical company is incredible -

2 days ago, my family’s A/C and dryer were not getting any electricity from our house’s breaker box due to a malfunction. After consulting with two other electricians, I was being told that the only solution would be to replace the entire breaker box - a solution that is not simple nor cheap.

However, we called Dr. Watts as a final hope and he came through. And it only took 25 minutes.

Not only did he fix our A/C and dryer’s electrical issues, he actually took the time the fix up the rest of our electrical wiring in the breaker box, and then explained to my wife and I the work he did, and why what he did was successful.

I will be contacting Dr. Watts for any and all services, and I highly recommend him as the go-to electrician in the Fort Novosel / Enterprise / Daleville / Ozark / Dothan Alabama area.","Nicholas J. VanSlyke"
,,"They showed up exactly when they said they would and did an excellent job!  I would recommend them!!!","Gail Scott"
,,"On time,good work,and very reasonable prices.I would highly recommend","Linda Council"
,,"Great customer service! Super sweet people! Fast turn around! Thanks!","Tara Knight"
,,"I needed some fans hung around the house so I gave Dr. watts a call. They were easy to schedule and showed up on time. The guys were quick and nice about getting the job done. All said they hung 4 fans for us in about 1.5 hours. The pricing was also very fair. If you’re looking for someone who knows what they’re doing, will be on time, and get the job done in a timely manner these are the dudes to call. They’ll be the only folks I call for any type of electrician work from here on out.","Lance Hughes"
,,,"Jacky Ward"
,,"Jamie at Dr. Watts Electric gets the job done quick and does thorough, great work! I needed a plug installed in a closet and he came quickly and had it done in no time. I will absolutely be calling Dr. Watts Electric for future electric and lighting needs!!!","Megan Watson"
,"Yes","My husband and I hired Dr. Watts upon the recommendation of a friend. We highly recommend and will use for any future needs. He upgraded our electrical panel and added the needed wiring for our HVAC unit as well as converted our hot water heater from gas to electric. Very professional, knowledgeable, and honest. Communication was also excellent as he not only communicated with my husband and myself but communicated with the company we hired to install our HVAC unit.","christy strain"
,"Yes","Was recommended Jamie for electrical repair by a friend from Dothan Transmissions and I’m so thrilled with my experience. Jamie came right out and knocked out an electrical repair in such a professional timely cost efficient manner. He went above and beyond and I highly recommend him for any electrical repairs!","RICK JAMES"
,"Yes","JAMIE is very professional- on time every time- communication is top notch- provides the work as stated- will be our electrician always.  The job- provided 50 amp breaker to main box and added an emergency breaker - ran electrical and underground - hook up to our Swim spa","John Groves"
,,,"Charlotte Singley"
,"Yes","We were very pleased with our service. Mr.Mcnelley was on time, very professional and completed work quickly. Good quality work and communication, easy to work with. We will definitely use this service again and will recommend him to others.","Daphne Marden"
,"Yes","I really wished my husband called for a estimate first but he was too sick to make that decision and we had a breaker going out. However the part only cost $140 and they charged us $$203 then on top of that $150 labor. We had no problem with the labor part of it  but overcharging for parts is pathetic.  We will pass this down to family and friends and tell them not to use you guys. Also the last 2 review comments is from someone in the company anyway so of course the comments are going be positive. This company is a greedy company and only to gain profit from overcharging parts.  Now they may see this and do better. I cannot say but they won't be getting our buisness
##Dissapointed","Ronda Barnes"
,"Yes","Unfortunately in my area it’s hard to find great professionals in any area of home construct/repair.  So when you find someone reliable and knowledgeable about their trade - it’s like hitting gold! Dr. Watts and team are our goto electrical pros. We wouldn’t go to anyone else. They are the absolute best.","Jojo Glowacki"
,"Yes","We had an issue with some outlets. They came right out and fixed us up. They were very reasonable and friendly. Highly recommend!!!","Nikki Haire"
,"Yes","Jamie is the most professional Master Electrician, with a strong customer focus that I have met in the last 20 years. Not only did he get to my needs early, he was quick and efficient. Look no further for quality and fair pricing in the wiregrass!.","justin goldman"
,"Yes","First off, the fact that Jamie returned my call was great.  He was willing to come out to my home and do an estimate, where others gave me nothing but excuses as to why they could not.  All the better because Jamie's work was excellent!  I needed auxiliary power ran out to my work shed and a receptacle for a portable generator on the side of my house.  I now have power out in my shed and I can now roll up my Pulsar 12,000 Watt Portable Generator and plug into my house without having to run a bunch of extension cords.  We are so happy knowing we are now totally prepared for a power outage.  I will definitely use Jamie and his crew for future projects.  Thank you!","Aaron Arguello"
,,"A+ service","austin r"
,,,"rick v"
,,"They fixed the problem and were nice","Alice White"
,,"The only state licensed Master Electrician in Dale county. Has a State plumbing and gas fitters license. Stands behind his work and is on time.","Cynthia Cherneski"
,,"Awesome service. Very professional and proficient. Will definitely call again for future jobs.","First Last"
,"Yes",,"Craig mcnelley"
,,"Always does great work! Jamie always gets the job done. I highly recommend Dr. Watts electric!","David McNelley"
,,"100% recommend.

I needed an outlet installed for my new stove, and Excel Power did the work within one day!

I’ve had absolutely no electrical problems with my stove and they even left no evidence (aka mess) of their work.

Quick, efficient, reliable, and good prices.","Charia Rose"
,"Yes","Lazaro Hernandez does excellent, excellent work.  I own a 90 year old landmark property in Geneva Al.  Lazaro and his team worked tirelessly for 4 days rewiring this old home.  I can't say enough good things about my experience!","eldo7709"
,,,"Shannon Golden"
,,,"Matti Roller"
,,,"Danny Hendrickson"
,,,"Bubba Womble"
,,,"donald Smith"
,,"Fantastic customer service, fair price, efficient, they've done work in Panama City Beach, Panama City, Lynn Haven and Chipley, Florida. Highly recommend!","Bubba McCants"
,,,"Matthew Saxon"
,,"Doesn't show up at scheduled time, does not return phone calls.Not worth the money!!!! If I could have put zero Stars I would have","Linda Abma"
,,"Worst contractor I have ever worked with. I called and asked for help with a service call.   They did some work changing out some bad lights.   After it was completed he never returned the old material costing us over a thousand dollars. I called for months to get the product returned with no cooperation.
DO NOT EVER USE THIS COMPNAY!!!","kyle knapp"
,,"This person is not worth your time don't use. And is a crook!!!👿👿👿👿 charged $65 to come out to look at my electrical box to see if everything was in order to have power then charged me $55 for a circuit breaker that was broke!!! AND WAS ASKING FOR THE MONEY BEFORE EVEN STARTED DON'T USE","Sally Marquez"
,"Yes","Tri-States installed several floodlights and ran wires for outlets/overhead lights for our businesses and installed them very quickly. I found them to be extremely helpful in making sure that our lighting needs were met. I would definitely use them again!","Brad Dunning"
,,"Great company!! Amazing work, attention to details, and gets the job done.","David Harris"
,,"Great","Madalynn Bean"
,"Yes","Eric installed a new circuit box and wiring on our home. He was excellent with keeping us informed, showing up when he was scheduled to show up and completed all the work in a timely manner. I am very pleased with all of the work he completed at our home, I would not hesitate to use him again for any electrical needs .","Cathy Moore"
,,"Installation of 200 AMP Service, Electrical Wiring, and Outlets for Ag Barn in Bonifay, FL.

I highly recommend Apgar Electric to deliver services for your electrical needs. Apgar takes pride in their work and clearly outlines the steps needed to resolve a problem in the simplest way possible. Based on their experience, Apgar offered me a unique solution to enhance my system performance beyond my initial request. Finally, Apgar provided service according to my schedule without delays and was very efficient in execution.

Thank you, Apgar; in a rural area experiencing skilled labor shortages and typical long wait times for help, it was refreshing to work with a company that delivered services quickly and professionally.

Dr. Pete Garcia","Pete Garcia"
,"Yes","Great Company.  Can't say enough good things about these guys.  They were prompt, efficient, and kept the site clean.  Did a multi-day job at my home, and always kept me informed as to the job progress.  I already have them booked to do another job at my home.","Mary Johnson"
,,"Very professional, came out quick and got the job done fast. And Very reasonably priced. Would definitely  recommend.","piotr szuba"
,"Yes","Outside meter repair. Had to rehire a real electrician to redo his mess.","FD Robinson"
,,"Quick and reasonable.","Julian Miller"
,"Yes","Buck did a great job wiring our new site in our RV Park, not all electricians can do RV Parks, and thanks for coming after hours when needed.  Anytime day or night he shows up, Thanks again!","Linda Marshall"
,"Yes","Power surge created outlets to become disabled and blown. Older home with bad wiring but all was handled promptly in a good timely matter.","Wanda Bryant"
,"Yes","Installation of Generac Generator.  Buck took care of the entire job including coordinating with power company and gas company and all permits required. Him and his Team did an excellent and professional job.  He always kept us informed on every step of the project.  Highly recommend him for any of your electrical needs.  Wayne/Pamela","Wayne Leavins"
,,"Excellent Electrical Work!!!

Buck is:
•Extremely Knowledgeable,
•Very Professional,
•A Hard Worker,
•Easy to Talk too,
•Had Very Good ideas,
•Very Good rates,
•Stella & Cary also did a great job working with Buck

I will definitely use Buck Electrical again and highly recommend his Services!!!","Dennis Ferrari"
,,"I called several times to get an estimate and he would not return my calls.  When I finally reached him he said he did not have time to go out giving estimates for ""small"" jobs.  He refused to give me an idea of what the cost would be over the phone and hung up on me.  It you have a ""small job""  call someone else.","Evan Ogden"
,,"I have 48 years of experience with contractors. Buck does not keep his word and he has a temper too. He never did provide a receipt that I needed for insurance purposes. Very unprofessional. If you must use him get it in writing first and don't pay until he is completely finished as after you pay him he will not keep his promises.","Jim Marlow"
,,"Absolutely amazing! He knew exactly what was wrong and charged a fair price. From the time he called to the time he fixed the issue was only an hour and a half. This was exceptional on a holiday. Thank you so much!","Samantha Westbrook"
,,"Great company. Called him around 6pm he was fixing our box and weather head the next morning so we could get our power back. Great guy. Highly recommend.","Suzanne Gerard"
,,"Do not use this electrician.  He scheduled 4 times and has yet to show up over a 2 week period.  I'm tired of promises and waiting.","Pat Abram Ault"
,,"Amazing experience. Got us booked quickly, arrived on time, and installed 2 lights and a fan in an hour! His rate was the best by far. Very nice, professional guy.","Ashley Boatwright"
,,"Flawless and awesome experience!! Kacey at Kent Electrical is nothing short of extraordinary! His expertise and customer service is unmatched, and he went out of his way to ensure the work and job was completely satisfactory. I couldn't be happier with the install of a 250 volt outlet to charge my vehicles. If you're in search of a great electrician and want QUALITY and TOP NOTCH customer service, Kacey is your guy!!","Ranbelt"
,,"Kacey did assessment of damage caused by fallen tree and emailed the estimate the same day. The power company messed up our scheduled cutoff but he called to advocate on our behalf.  We finally got power company out and he made sure the lineman stayed while he finished the job. Power was restored quickly.  Very professional. We will use Kacey for future service needs.","Beth Watson"
,,"We needed an emergency repair after a tree took down a power line and ripped the breaker boxes and meter box off the wall. We called Kent Electric, and they came out the same day for a quote, doing the needed repairs the very next day! Kent Electric is top quality service, with affordable pricing!","Dennis"
,,"Very professional job, great cleanup of the area when job completed.  Really good value for the job.  Would highly recommend for your electrical needs.  Wayne","Wayne Leavins"
,"Yes","awesome guy. quick to respond, professional, fair pricing, very knowledgeable in the field. I will use him again and again when it comes to electrical. you want the best use Kent's electric.","Kathy king"
,"Yes",,"monique maggard"
,"Yes","Kasey from Kent Electric was amazing! He was fast and persistent in making sure our every need was met. He did everything we needed including whole home new construction wiring and fixture installation. Kasey made our little dream home so welcoming! Will definitely call him for any electrical needs we need in the future!","Caleb & Karen Segers"
,,"Very professional, prompt, and responsive. Rewired our whole house and wasn't even phased by the scope or complexity. Stuck with the job even when the general contractor up and quit.","Jason Neumann"
,,"Showed up on time done an excellent job it looks very professional I have never had a Box wired that looks so good, his appearance professional clean. If I have any electrical work done I don't care what it is I will be hiring Kent  electric he did a very good job at a very affordable price. If you could see pictures of his work you would hire nobody else I can use my eyes in the electrical Box and follow every wire to where it goes it's not a jumbled up rats nest, And he had to work in the direct sunlight very hot did not stop work until the job was done, I can't say it enough  good about him, I had never met him until the day he showed up but I will definitely hire him again if I need electrical work. Even took time to explain to my wife how to work the timer I also had him install.","Brent Stoker"
,,"Professional and trustworthy! I trust Kent Electric to get the job done and to do it CORRECTLY. He is extremely professional and courteous","Lauren Maynard"
,,,"Sophie Herrington"
,,,"Jody Clements"
,,,"Akae Hiram"
,,,"Milton Evans"
,,,"Mrbtown300"
,,,"Teri Goff"
,,,"Alan C"
,,,"Tonya Tucker"
,,,"Dr. Yangus Bottom Tooth"
,,"Rv park and moble home trailer park.. with swimming pool.","Deanna Schmidt"
,,"Amazing work! Would recommend to anyone in need of electrical work.","Whitney Bolt"
,,"Amazing service!  Extremely professional and did everything by the book.  Took a frightening electrical issue and re-wired my home  to code.","Kimberly Smith"
,,"Mr. Pierce was friendly, professional and prompt for our commercial property. Would give 10 stars if we could.","Laura Spurlin"
,,"I appreciated the quick, professional service they provided.","Shannon Turnage"
,,,"Mihir Pradhan"
,,"Your employee who parked in the handicapped zone with the disrespectful reply should be fired.","Timothy Wert"
,,"If I could leave less than one star I would. The employees of this company park in handicapped spots without permits and take advantage of people with disabilities. Unacceptable, do not do business with these people.","Calen Santos"
,,,"Bobby Derome"
,,"Absolutely the best at what they do","Joe Hicks"
,,,"Craig"
,,"Reliable, professional and resonalble.
Justin is the guy for all your electrical needs","Scott Browder"
,,"We had two outlets that stopped working and needed our dishwasher removed from an outlet. Brad came out in a timely manner, explained the problems, and fixed them in a flash. The cost was reasonable. We will be calling Bulger Electric for future outdoor lighting and other projects we have in mind and have already discussed them with him.","JoJo M3"
,,"Phenomenal service and exceptional communication. Great guy and great company! Give them a call!","Ben Trickett"
,,,"Daniela Payant"
,,,"Jann Ballard Thompson"
,,"such a great team to work with..kind and professional..rewired an entire house for me that was built in 1915 !","Jill Bowden"
,,"Phenomenal experience from a season professional. Replaced my 39 year old breaker box, installed an outlet and an EV charger, all on a Saturday. Professional, friendly and thorough. Highly recommended.","Kevin Gardner"
,,"John Phillip's came out to my home. He was early, polite, professional, and got the job done in a timely manner. His prices are reasonable. I had an additional electrical panel installed next to the pre-existing panel along with a 220v outlet for a shop compressor. I highly reccomend JP Electric!","Adam Dozier"
,,"I recently did a large home renovation in Birmingham. We rearranged walls, closets and bathrooms. I was the acting GC with no prior experience. Jason was very helpful in achieving the looks we wanted in every space. He installed lighting, vent fans, sconces, outdoor lighting, a new sub panel and a ceiling fan. The lighting in the bathrooms looks incredible. I haven't seen bathrooms that look as good as these. Excellent work.","Patrick Fredella"
,,"Jason was absolutely amazing. Prompt, knowledgeable, and just a good dude. He came out on a Saturday because we didn't have hot water and was kind, quick, clean, and affordable. 100% recommended.","Sarah Knight"
,,"Jason was fantastic. We had a problem with some of our switches that we couldn't figure out. I called Jason yesterday evening and he was at our house first thing this morning. Excellent work and even better customer service. Highly recommend.","Jared Dobbins"
,,,"William Kimbrel"
,"Yes","I recently had the pleasure of working with Bledsoe’s Electrical to have new electrical plugs installed in my home, and I am thrilled with the results. From start to finish, their service was nothing short of exceptional.

The entire process was smooth and hassle-free. They provided a detailed estimate, outlining the scope of the work, costs, and a reasonable timeline for completion. This level of transparency was greatly appreciated.

He arrived on time, and his work was nothing short of impeccable. They took great care to ensure that the new plugs were not only functional but also aesthetically pleasing. The attention to detail was evident, and the finished work blended seamlessly with my home's existing electrical setup.

What truly sets them apart is their commitment to customer satisfaction. They went above and beyond to answer my questions and address any concerns I had during and after the installation.

In summary, Bledsoe’s Electrical exceeded my expectations in every aspect of the plug installation. Their professionalism, attention to detail, and dedication to customer satisfaction make them the go-to choice for electrical work. I highly recommend them to anyone seeking top-notch electrical services, and I will undoubtedly turn to them for any future electrical needs.","Fred Miller"
,"Yes","An honest and reliable electrician!

Jason will be one of my go-tos for all things electrical. He was responsive, knowledgeable, efficient, and professional. I reached out to Jason in a bit of crunch with a client needing a second opinion and repair work on a few items that came up from a home inspection, and he quickly responded and got over to the home. He explained what was going on without talking over my head, accurately priced the work and made the repairs with time to spare before closing. Jason was great to work with, and both my client and I were appreciative of his time and efforts.","Jasmine Kemp REALTOR"
,"Yes","Jason arrived promptly and installed our fire alarms, outlets, and repaired our panel correctly and efficiently. We'll definitely use him again and send him to all of my friends and family!","Vinetra King"
,,"Great company, excellent work. Jason gets the job done professional and fast. You call he answers. It's hard now a DayZ to find a company that's well rounded and provides good service.","Jonathan Bell"
,"Yes","Reached out to Jason about a faulty range outlet. He was responsive and got out here quickly. He figured out the issue and got everything up and running in 30 minutes. Professional, knowledgeable, and reasonable. Highly recommend","Daniel Logan"
,"Yes",,"Kaleshia Coleman"
,,"Very prompt and does very neat work!! I am pleased with the installation of my new Tiffany style lamp in my kitchen as well as the repairs and reworking of my bathroom lighting. I look forward to Ryan putting in a whole home surge protector. I highly recommend Wire Nuts!","Chanda Mitchell"
,,"I have an older house with crazy wiring that has been altered over the years by previous owners. We were experiencing lights going out on their own and other receptacle issues. I called Ryan, and he was quick to respond and showed up on time.
I explained the issues, and he patiently listened; I could see he was thinking and processing the information. He set off to investigate, and within about 20 minutes, he said he knew what the problem was and got to work.
There were wires crossed and bad grounds all over the house. He has been out several times now and has fixed so much bad wiring, run new wires, put in a new panel, added new circuits, etc.
I can’t say enough how grateful we are to have found him.","Jason Campbell"
,,"Came when he said he would. Fixed our problem. Reasonable. JD is a very nice man.","Charlotte White"
,,"JD Electric is the best quality and value around Huntsville.","Jason Crowson"
,,"Friendly service. JD found our electrical problem fast. Highly recommend!","Waymon Kilmer"
,,"Great people!","Ann Walthers"
,,,"Ashiv 76"
,"Yes","This business has handled multiple jobs on both our home and on our rental properties. If you want good honest workers who do a great job at a very affordable price, then this is the company for you!","Bonnie Harrison"
,"Yes",,"Jeremy Self"
,,"Good and honest electrical company. Would recommend them to everyone.","Dewayne Sloan"
,"Yes",,"Jeremy Self"
,,"Brian and his team did a great job with several changes to our home.  They installed new lighting, plugs and moved some lighting fixtures.  I found them to be prompt, dependable and easy to work with.  Highly recommend them to business or residential customers.","Melanie Wilbourn"
,,"Mr. Bailey is a decent, honest, conscientious businessman. We have had them out to work at our house twice. Both times they did great work, quickly and see a decent price. We will use them again!","M Naderi"
,,,"Lauren Self"
,,,"Rebecca Baldwin"
,,"Bryan and his team did an excellent job installing new electrical equipment and repairing old electrical equipment in my home.  They got the job done quickly and efficiently and left without leaving a mess for e to clean up.  Thanks guys.","Robert Brown"
,,"Excellent service!!!","Donna Wright"
,,,"Kitty Williams"
