"rating","reviewContext/null","text","name"
,,"Brandon is a machine. If you turn your back a few minutes he is done with the job. Very fast, efficient, with expert work. Used him for entire home remodel and had zero call backs. It’s always done right, on time with professional attitude. Never ran into a problem he could not repair!","David Ruggerio"
,,"Very professional, personable, and quick service!!! I am satisfied!!!!💜","Latoshia Pettway"
,,"Whalen Electric was recommended by a friend. When I called them, they came when they said they would, they corrected the issue, and were reasonably priced. I will use them with future electrical issue","Ellis Till"
,,"Whalen Electrical is a professional and quality service driven business.  I was very impressed with their work.  Exceptional every time!","Jay Clyce"
,,"Found the problem right away. Great service. Highly recommend","Zac Smitherman"
,,"I have used Brandon on numerous electrical repairs over several years. He has always done an excellent job, in a timely manner, with good prices. Highly recommended.","Don Sharpe"
,,"Brandon has done extensive electrical work for me and I have found his work to be of excellent quality. I judge Brandon to be dependable and trust worthy, and I find his charges for service to be fair. I would and have recommended Brandon to others.","Chris Pruitt"
,,"Brandon is awesome!!!! Called him at the last minute. He was as on time friendly and fast and efficient.  Very conscientious about how you want things. In tune with making sure you are satisfied.  Love it!!
Would recommend him with no doubts.","ivette steadman"
,,"I own a swimming pool company in Birmingham, AL. Since the day I started this business, I have used Brandon with Whalen Electric solely for all of my electrical needs. Brandon is beyond excellent with his communications skills and customer service. I have never given him a problem he couldn’t solve. I’m extremely blessed and thankful to have met Brandon and look forward to our next of very many jobs together!

10/10 would reccommend! Timely, knowledgeable, and just an all around great company to work with","Pierson Atkinson"
,,"Very timely and respectful of property. Did what was needed and did not add on when I suggested something as he said it was not necessary.","Lynellen Mallett"
,,"Excellent! Friendly, professional. As good as it gets.","scott meyer"
,,"Highly recommend! Brandon was very helpful when we needed electrical help.","Heather Windle"
,,"Great service friendly and did a quick and great job!!! Would definitely recommend","Jim Jonathan"
,,"couldn't be happier with their service. highly recommend these folks. professional service in more than a timely manner.","AL Guns"
,"Yes","Brandon has always done an amazing job for us, through the years. Most recently, he installed new lighting on our front porch as well as running electricity to our new covered deck in the back. He added a ceiling fan, light fixture, multiple (weather resistant) outlets and added an outlet specifically for our wall mounted TV outside. We really can’t say enough good things!","Britney Moore"
,"Yes","Excellent service! After a tree fell on the side of my house damaging my electrical box Brandon came out and worked in the dark to repair my box so that APCO could restore my power quickly. I will no doubt use Whalen Electrical again.","Tina Nicholas"
,,"Good honest people","Lee Headley"
,,"NOT LICENSED OR BONDED AS CLAIMED! Our family hired Leonard, the owner of A-1 Electrical, for several jobs including wiring a finished basement, motorhome shed, and adding electrical for an upcoming mother-in-law suite. We paid him and his apprentice nearly $8,000 total and the work was left unfinished. When we raised it to his attention he PROMISED us he would be back to finish - once other contractors were out of the way. After a brief conversation tonight, not only did he fire his wonderful apprentice, he has refused to finish the agreed work and voided our contract. My elderly mother-in-law is left with an unfinished electrical, including lights and fixtures. Leonard said we could ""finish it ourselves."" We have been more than accommodating, understanding, and reasonable with A-1. This unprofessional behavior was totally unwarranted and uncalled for. AVOID THIS COMPANY!","Uhapi Beauty"
,,"Not a good idea to use Lenny hes a scammer!!!","Tim Lopez"
,,"Great service gave me a quote and came out an hour after I called found the problem about 30 minutes after he was here and started to fix it I will be calling him again if I have any more problems!","Kimberly Gilbert"
,,"Was given a 450 dollar price to hook up a hot tub. Spa box, breakers plus 30 ft cable included. I came home to a hot mess! There wasn’t even a 220 breaker in the breaker box and spa box not even hooked up to hot tub. I was told they needed another 220 to come finish the job. seriously??? I think NOT","Tammy morgan"
,,"Very expensive.","Frank George"
,,"Highly recommend. Arrived on a Saturday and completed the work the same day.","Derek Nicholas"
,,"My go-to Sparky! Top notch service! Great guy , professional and efficient. Mos def recommend!","ada hamouz"
,,"Very quick and efficient. He arrived when he said he would, which was less than two hours from when I called. In and out within 30 minutes and even took the old materials to be disposed of. Thanks again!","Janna Dunn"
,,"Did exceptional work on installing a new box and all new light fixtures in our new home. Even helped with the garage door. Amazing quality service at a reasonable price.","Daniel Baker"
,,"Friendly place","Doris Turk"
,,"It is my grand baby nothing compares to them","Patti Jones"
,,,"Adrian Canles"
,,"Had electrical work done and was extremely pleased with the service I received. Prompt service. Friendly workers.","Charlotte Creely"
,"Yes","We had Tyler do several things around the house and it was fine until either he or his assistant stood on a brand new range we were storing in the garage for our kitchen remodel. I guess they stood on it instead of using a ladder. When we opened the box to move the range we saw the glass surface was cracked and the legs were broken. I called Tyler several times and other people answered the phone, but never called me back. If he has insurance, this is what it's for, so it shouldn't be a big deal. He lost all my trust.","Chris Ayers"
,"Yes",,"Brad McArthur"
,"Yes",,"Anedria Long"
,,,"Eileen Emond"
,"Yes","They are very good at what they do","Pam Letterman"
,,"Great service, great experience with service tech. Would highly recommend.","Marion Lovell"
,,,"Jessica Faulk"
,"Yes","I stopped by J&J Friday morning June the 25, they took time to talk me through the problems I was having and sent one of their employee’s, David Hendrix, out as soon as possible, around lunch time the same day. David did an excellent job. J&J is honest and reasonable and well help you as much as they possibly can. Thank you John and if I ever need another electrical job I’ll be back.","terry boling"
,,"Excelent electrician.","Clifton Payne"
,"Yes","On time, profesional, the technician was extremely knowledgeable and willing to explain in detail the extent of the job. He answered every question and was in and out in a timely manner. All in all as a first time customer i will be calling J&J for all my electrical needs. The tech said his name was kasey and i will definitely be requesting him. Hope this helps....","Don Summers"
,,,"Wyatt Jones"
,,"Mostly commercial work and very little  residential work. Always great service, friendly, understanding, and easy to work with.","Jeremie Taylor"
,"Yes","Jacob of NexGen Electric has provided both commercial and residential services for me over the years.  He is courteous and performs quality work.  Additionally, I have found his prices to be very reasonable.  Good stuff all around!","Andrew"
,"No","I heard great reviews about this company! Tried to call them a year ago for some electrical work I wanted to have done ~ after numerous calls went unanswered and mail box was full, I started sending text messages since mailbox is full, I also went on website requesting to be contacted ~ never received a response nor call back from Jacob. Decided to wait on job, a year later today ~ I tried unsuccessfully to call, mailbox still full and no call back. Others have commented on Jacob's professionalism as well as responsiveness in between the times I have tried to reach someone, anyone ~ is there another number besides the one I was given for NexGen which is the same as the number listed on their website or is it a select few that this company works with?","Delta Price Butler"
,"Yes","We loved Jacob he was very hard working and did an outstanding job. Would recommend him to anyone.He did the electric for an addition to our house.","Gail Tench"
,,"I have used this company twice now and both times very professional and the work was outstanding.  No complaints here....will use him again when needed!","Debbie Frederick"
,,"Quality items with excellent prices!","Jill Grant"
,,"We have had Jacob come and do a number of electrical projects around the house. He is SUPER nice and highly knowledgeable. He always takes care of us and sticks to his quotes. Everything he has done for us has been done well. We approach him with broad ideas of what we would like to do, he tells us his plan for how to make it happen, and then he does his magic. Great guy, we use him all the time.","Hardy Ulmet"
,,"beacuse it don  fo noing","Alissa Harris"
,,"Jacob is an amazing guy. I had tried to install some recessed lighting myself (and this is hard to say, but) I couldn't get it working. I was told about Nexgen, gave them a call, and he was out here the next day. Within 20 minutes he had it all sorted out. Very fair pricing too. Thank you!","Doug Hoffman"
,,,"William Bozeman"
,,,"Shirley Bozeman"
,,,"Brad Barron"
,,"Excellent work completed. Professional and highly recommend . Always pleased with repairs completed.","Sandy Shelton"
,,"You're not going to beat the service,very knowledgeable, when it comes to electrical issues. The prices are reasonable, everyone has got to earn a living. He replies to all calls or texts. I highly recommend this person/company. He's grown this electric business from the ground up with determination, honesty,ability and experience.","Kaye Emerson"
,,"WOW is all I can say!  Very Nice to have a contractor who actually shows up on time, and gets the job done!

Jeff and his crew were very nice to work with, and were always on time!  I will be using them for all of my electrical needs in the future, and I would recommend this group to anyone who wants the job done right!","David Clower"
,,"Second job completed for me. Excellent quote, on time,  work extra hours to complete the job. Recommend Jeff and his crew for any electrical needs. You will not find anyone nicer or efficient  doing the job.","Stanley Linderman"
,,,"LaST-ReBEL32 Berryman"
,,"Great service. Friendly people. Job well done. Very affordable.Would recommend to anyone needing electrical work done","Connie Glasgow"
,,"Great experience! On time, quote stayed the same, didn't leave a mess.  Did an excellent job!!","tank master248"
,,,"Tayvyon Fuller"
,,"I had a small project and K & S Electric was recommend.  They worked me in for an evaluation that very afternoon and were able to find and repair the problem.  I will use them again and definitely recommend their work! Courteous. Timely.  Affordable.","BECKIE EDWARDS"
,"Yes",,"Clohe Chatham"
,,"Mr. Justin came out looked at the job.  Was a pleasant experience.   Today received the quote.  I approved the quote.  Just waiting to schedule the job.","Johnnie Jennings"
,"Yes","Needed some electrical repair, upgrades and installation work done. Bowen Electric did professional, quality work for a reasonable price.","judy vaughn"
,,"Nice place to practice any sport","Brennon Bailey"
,,,"Gennifer Williams"
,,,"Riva Warren"
,,"Outstanding","Michael Carney"
,,"Professional and great work for  good prices","Aubrey Lane"
,,"Great service! Very reliable and trusty worthy work.","Mikala Bellville"
,,"Honest and intelligent people! Amazing work they do for a fair price. Highly Recommend!","Google Melts"
,,"The guys were a great help and very knowledgeable.","John Walker"
,,"Reliable service. Great prices","Lace Woodham"
,,"Sick","Shekesha Marshall"
,"Yes","I plugged something in that I shouldn't have plugged in and caused half my house to be without power.

I called Daniel and he came out that day.

He was courteous, professional and fixed the problem same day.

I have had Daniel come back and do some other electrical jobs around my home.

I would definitely recommend Daniel for any electrical needs that you may have.","-"
,"Yes",,"James"
,"Yes","I highly recommend this company! High quality workmanship, professional and very responsive. Thanks so much!","Kathy Sommer"
,,,"Chrisma Singleton"
,"Yes","Excellent services. Very friendly and knows his work. I would recommend this company any day. You will be well pleased.","mrs bama"
,"Yes",,"Dillon Summers"
,"Yes","Mr. Rodriguez did and excellent job! He was very responsive, punctual, and professional. He had the knowledge and expertise to handle your electrical issues and offers a fair price. I wouldn't hesitate to go with him again if needed.","Jarrett Virgil"
,,"Mr. Dwayne came in the rain to fix my heating system... He got a small part the next day and came back... This took less. than 2 hours for both days... He could have charged me double time for a Saturday as well..., but only charged me 2 hours at the lowest pricing... So good to have an honest and dedicated working specialist like Mr. Dwayne... I will have him do ALL my electrical needs... Thank you again Mr. Dwayne...","Louise D"
,,"Reasonable Price.","Vonsha Marshall"
,,"Dwayne came to give me a quote barely looked around. Asked did we want him to do the job without giving us a price & left & said he would be back. Never came back. I guess y'all don't want my business or my money. Definitely won't be recommending y'all!😠","Denise Gerstenschlager"
,,"Didn't check things like they should have and charged me $120 . Told me they had to run new wires and that would cost $1700. Of course I didn't do it.  Im glad I didn't because I called another electrician and it was a tripped breaker.","Stacey Phelps"
,"Yes","Made Island Electric my number one person to call.","Mark"
,,"Amazing local guy. Thank you for restoring our power on a Sunday and for knowing the ins and outs of a big condo.
Strongly recommended!!","Richard Aoun"
,,"I called this morning in need of electrical work to be done. These gentlemen were quickly to respond to my needs and completed the job at a very affordable price. I will only use Island Electric from now on. I highly recommend Island Electric.","Kevin Jones"
,,"Thomas was amazing to deal with very reasonable rate showed up on time did a great job...glad I searched the google reviews first","U St"
,,"Very good, professional","Bill Lasater"
,,"These guys are Top notch, thanks guys.!","Phil Castellano"
,,"Its an amazing company.They were every professional and were a complete delight...Thanks guys!!!!","Kady Hall"
,,,"Dean Bennett"
,,"Great gentleman's fast and quick. Very reasonable price no price gouging.","Jill Avent"
,,"brown electric is outstanding in every respect- thorough, timely, professional, knowledgable.  jason knows the electric business.  he has done everything from installations to repairs at my house.  always ready with suggestions to consider for any job.  he is a ""go to"" electrician.

hank martin
cantonment","Hank Martin"
,,"Hired Stan to change several light fixtures and ceiling fans in a home we purchased in the Orange Beach area. He also added a couple outlets.
He was very professional, timely response, and priced fairly.
I will continue to use him for any electrical needs.","Cori Staples"
,,"Was great to work with.  Extremely professional! Always showed up on time if not a bit early and work was done as scheduled and as promised. Won’t hesitate to hire again.","Chez"
,,"Great Subcontractor.  I've worked with Stan on several projects. I'd highly recommend Stan to anyone with confidence.","Premier Construction / Handyman"
,,"Home Electric is my go to company for anything electrical. Stan has completed numerous projects for me over the years. He's reliable, professional, & courteous. He looks out for my bottom line charging me fair prices and makes qualified suggestions for improvements and cost savings. I'll be using his services for years to come.","Ty Ingmire"
,,"Stan at Home Electrical Services diagnosed an issue I was having with a breaker tripping due to an overloaded circuit. He explained why it is happening and how to prevent it without having to do a costly repair. Amazing service, I will definitely use him/Home Electrical Services again next time I have an electrical issue.","Jamie Moose"
,,"Good service, great communication, fantastic work!","Chad Staples"
,,"Home Electrical Services has done work for me.  The wrk was quality work   HES was trustworthy and reliable. I highly recommend Home Electrical Services.","Ellen Bray"
,,"Very responsive. They did top notch work!","Leroy Maxwell"
,,,"Gabrielle Zlab"
,,"Fast, great service and price. Jon did a in an unusual situation.","Tamra Smith"
,,"I tried to use these guys and after 3.5 weeks they stood me up, really messing up my schedule.  Unreliable","Don Blancher"
,"Yes","I am so very impressed! I put my claim into my home warranty company at 9am, Jon called at 10am, was at my house at 1pm and completed the job (replaced a breaker) at 2pm!  I have already talked to him about future work!!","Jeannetta Bell"
,"Yes","Lighthouse Electric of Gulf Shores' owner,  Jon is the absolute greatest person to tackle a job and get it done.  He kept us well informed as he used various resources to hunt down parts for a fan that was no longer in circulation.  And now,  all is well.  Because of Jon, there are no disappointments in our household. Our fan is now, back up and running like new with lights burning brightly.  Thank you Jon for being professional,  punctual, polite, informative, respectful and a man dedicated to providing the best service in his craft.","Barbara Harris"
,"Yes",,"Nick McConnell"
,"Yes",,"J G"
,"Yes","Awesome and professional service!! Happy we hired this business to take care of our electrical needs.","ItssssNick"
,"Yes","Jon called and said he was on his way and arrived on time. We met and he asked a few questions and took a look at the problem and got right to work on solving it.  Afterwards we talked about how I can go solar and get off grid","TED DAN"
,,"Not very friendly when answering the phone.","Theresa Smith"
,,"Mr. B.J.'s team was professional, fast, and did an amazing job. They worked me into their schedule, and I am appreciative of the quality services completed.","Chassity Simmons"
,,,"Alexander Guillen"
,,,"David LoBello"
,,,"kimberly houk"
,,"Danny Hamner did multiple electrical projects for me while in Tuscaloosa, Al. Baldwin county you got the best! Good luck!","carole faucett"
,,"I’d recommend Danny to anyone! He replaced my old 6” recessed  can lights to the new Led replacements. He was very knowledgeable on how much money I would save per year by using a lower wattage Led fixture versus the high wattage Par 38 bulbs that were in my particular cans. He also explained the benefits on my electrical bill with the reduction of heat from the LED’s. Thanks Danny!! The lighting is great, I got an education, and I’m Saving Money 💰. I’m looking forward to seeing you again once my barn is ready to be wired!!","Mitchell Harrison"
,,"We just moved into the Fairhope area.

Dan Hamner of Hamner Electrical Services was hired to install a ceiling fan in the living room. He was prompt, courteous and very professional.

While he was at the house, I had mentioned that a few days ago three of my electrical outlets had stopped working.

Dan checked all the outlets and found that there was a problem with one particular line. He went up into my attic and discovered that someone (previous owner?) had spliced an additional electric line into the existing living room line.

That splice job had apparently come loose a few days ago and started to arc. The splice wasn't even contained within an electrical box. It was just wire nutted and taped. Dan cut out and brought down the old splice and you could smell that it had burned.

Dan mounted a proper electrical box in the attic and connected the wiring up to code.

His willingness to investigate something that he wasn't even originally hired for, most likely saved my house from burning down.

If that doesn't qualify as a real recommendation, I don't know what would.","Bradley Lanser"
,"Yes","Ashley furniture delivery drivers hit my power line and practically ripped the mast and electrical services from meter. After a phone call, D1 showed up to my house in about an hour, and repaired everything. They also contacted Cullman electric to get the power hooked backed up. I am forever grateful for them coming on the same day and getting everything repaired so quickly. I will definitely use this company for an future needs. HIGHLY RECOMMEND!","John Alford"
,,,"shawn collier"
,,,"Peter Bernal"
,"Yes","His advice kept me from making a big mistake.","Andy Stewart"
,,,"Sheena Cox"
,"Yes",,"Christopher Brittain"
,"Yes",,"Melissa Miller"
,"Yes",,"Nora Gomez"
,,,"Elizabeth Kelley"
,,,"Jason Booker"
,,,"paul cunningham"
,,"Bated Electric has consistently provided quality electrical work over the years for me personally and for my businesses. I highly recommend Mike Bates and his company Bates Electric.","Ronnie Black"
,,"Gadsden Electric

Very kind and professional
The best price
The best quality work, even Alabama power said they did a beautiful job!
And here within an hr of my call!

I highly recommend them for any and all electrical services","scizorhand scizorhand"
,"No",,"Deanna Reeves"
,,,"Maria Lively"
,,"Levi with AIS Electric is amazing!  He knows what he is doing and knows most of his clients have no idea what he is talking about. He took his time and explained to me in terms I would understand about what I need to do.  He even showed me how to do what he was doing and let me quietly watch.  Definitely will be using him for my other electrical projects at home.","Marie Foley"
,,"I have had AIS Electrical install an attic fan, run wire for an outdoor camera and run wire to a floodlight as well as install new floodlights to existing wiring. Plus when I was in an emergency situation with a loose neutral, Levi came out first thing in the morning to troubled shoot the problem and direct me in the right direction to get my electricity fixed on a very hot summer day so I wouldn’t be without air condition. Very professional, quality work & in constant communication. Highly recommend.","Chance Powell"
,,"AIS Electric Company has handled multiple jobs for me and have always exceeded my expectations. Levi is not only highly skilled but is also incredibly professional and courteous. He has always arrived on time, meticulously assessed each situation, and has always provided a detailed and transparent estimate. His knowledge and expertise is always evident as he explained the best solutions for my needs. What impressed me most was his attention to detail and commitment to quality. I highly recommend AIS Electric Company for any electrical needs, whether residential or commercial. They are reliable, trustworthy, and deliver exceptional results.","Gabe Henderson"
,,"Wow! AIS Electric is amazing! I’ve had several outlets out in my home, as well as some interesting wiring, and Levi was very knowledgeable in both explaining and fixing the issues. Very friendly, honest, and efficient guy!","Alohra Rhoades"
,,"AIS is knowledgeable, professional and innovative at every angle of electrical! Great team to use for residential or commercial needs. Highly recommended!","Abigail Cline"
,,"I have had the pleasure of working along side Levi with AIS on jobs a couple different times. His workmanship is top notch, but he is also a honest and trustworthy guy who will do what he says and do it correctly! If I could give 10 stars, I would!","Joshua Owenby"
,,"Levi and his team were prompt and professional.","Catherine Lee"
,,,"Tracie Wiggs"
,,,"James Robert"
,,"Doesn't show up, doesn't call.  When you are in need, this is not the guy to call.","Ashlee"
,,"Great service","Greg Davis"
,,"Mr. King is very personable and is very knowledgeable about his job. He was hired to rewire our house and after paying half of the price, he finished only about 1/4 of the job. After 16 months of promises, we finally hired another company that finished the job.","Joan Bookman"
,,"Came out same day and worked until the job was complete due to the nature of our problem. The craftsmanship and attention to detail was very reassuring throughout the process. Highly recommend to anyone needing electrical work done.","Tate"
,,"I would like to add my voice to all the others who recommend Frank King.  Although Frank, like everyone I know who works in skilled trades, has difficulties sometimes meeting his appointment goals, he is a stellar electrician.  You will not find a more skilled and conscientious person who cares more about his customers.  I heartily recommend him and will use him whenever I can.","Scott Williams"
